{
  "generated_at": "2026-09-14T10:00:00Z",
  "repo": "gavrielc/team-pulse",
  "range": { "from": "2026-08-15", "to": "2026-09-14" },
  "summary": {
    "total_commits": 42,
    "total_contributors": 3,
    "total_prs_merged": 6,
    "total_lines_changed": 1875
  },
  "members": [
    {
      "login": "gavrielc",
      "name": "Gavriel",
      "avatar_url": "https://avatars.githubusercontent.com/u/1",
      "commits": 20,
      "prs_merged": 3,
      "last_active": "2026-09-13T18:22:00Z"
    },
    {
      "login": "pulse-api",
      "name": "Ari",
      "commits": 15,
      "prs_merged": 2,
      "last_active": "2026-09-14T09:10:00Z"
    },
    {
      "login": "pulse-data",
      "name": "Dex",
      "commits": 7,
      "prs_merged": 1,
      "last_active": "2026-09-14T10:05:00Z"
    }
  ],
  "weekly_trend": [
    { "week_start": "2026-08-25", "commits": 10 },
    { "week_start": "2026-09-01", "commits": 14 },
    { "week_start": "2026-09-08", "commits": 18 }
  ]
}
